[
  {
    "npc_roster_id": "npc_roster_marrow_vell",
    "display_name": "Marrow Vell",
    "faction_id": "meg",
    "primary_function": "QuestGiver",
    "services": ["Quest", "Storage", "Mapping"],
    "hub_location": "hub_quartermaster_corner",
    "level_focus": "Level 1 Service Halls",
    "security_profile": { "can_fight": false, "can_be_hired": false, "can_hire_security": true },
    "lore_connections": ["M.E.G. archive culture", "Level 1 service corridors", "Almond Water survival"],
    "personality_hook": "Dry survival mentor who remembers every lost route by the item left behind.",
    "description": "Main V0.1 quartermaster and first five quest giver."
  },
  {
    "npc_roster_id": "npc_roster_the_turnstile",
    "display_name": "The Turnstile",
    "faction_id": "bntg",
    "primary_function": "Trader",
    "services": ["Buy", "Sell", "Repair"],
    "hub_location": "ticket_trader_kiosk",
    "level_focus": "Abandoned Theater Corner",
    "security_profile": { "can_fight": false, "can_be_hired": false, "can_hire_security": true },
    "lore_connections": ["B.N.T.G. trade culture", "Movie Ticket economy", "Supply outposts"],
    "personality_hook": "Speaks like an old station machine that learned bargaining from desperate people.",
    "description": "Ticket-based survival trader."
  },
  {
    "npc_roster_id": "npc_roster_sera_latch",
    "display_name": "Sera Latch",
    "faction_id": "meg",
    "primary_function": "Hybrid",
    "services": ["Quest", "Medical", "Training"],
    "hub_location": "meg_triage_desk",
    "level_focus": "Sanity and Almond Water use",
    "security_profile": { "can_fight": true, "can_be_hired": false, "can_hire_security": false },
    "lore_connections": ["M.E.G. archive culture", "Almond Water survival", "Entity documentation"],
    "personality_hook": "Gentle voice, terrifying field notes.",
    "description": "Medic-researcher who teaches sanity survival and post-run recovery."
  },
  {
    "npc_roster_id": "npc_roster_orin_mapwake",
    "display_name": "Orin Mapwake",
    "faction_id": "meg",
    "primary_function": "QuestGiver",
    "services": ["Quest", "Mapping", "Radio"],
    "hub_location": "meg_map_wall",
    "level_focus": "Service Hall route mapping",
    "security_profile": { "can_fight": false, "can_be_hired": false, "can_hire_security": false },
    "lore_connections": ["M.E.G. archive culture", "Level 1 service corridors", "No-clip transitions"],
    "personality_hook": "Never looks at people directly, only at exits behind them.",
    "description": "Map archivist for route quests and level-return objectives."
  },
  {
    "npc_roster_id": "npc_roster_june_brightwire",
    "display_name": "June Brightwire",
    "faction_id": "meg",
    "primary_function": "Trader",
    "services": ["Buy", "Sell", "Repair", "Radio"],
    "hub_location": "meg_radio_bench",
    "level_focus": "Radio and scanner gear",
    "security_profile": { "can_fight": false, "can_be_hired": false, "can_hire_security": false },
    "lore_connections": ["M.E.G. archive culture", "Entity documentation", "Supply outposts"],
    "personality_hook": "Names every radio after someone who stopped answering.",
    "description": "M.E.G. comms vendor and radio upgrade contact."
  },
  {
    "npc_roster_id": "npc_roster_voss_halden",
    "display_name": "Voss Halden",
    "faction_id": "meg",
    "primary_function": "Security",
    "services": ["SecurityPatrol", "Training"],
    "hub_location": "meg_checkpoint",
    "level_focus": "Hub defense and entity drills",
    "security_profile": { "can_fight": true, "can_be_hired": true, "can_hire_security": false },
    "lore_connections": ["M.E.G. archive culture", "Entity documentation", "Safe-room settlement life"],
    "personality_hook": "Counts exits before entering any room, then counts people.",
    "description": "Security recruit for hub defense tutorials."
  },
  {
    "npc_roster_id": "npc_roster_cass_bracket",
    "display_name": "Cass Bracket",
    "faction_id": "bntg",
    "primary_function": "Trader",
    "services": ["Buy", "Sell", "Crafting"],
    "hub_location": "bntg_parts_counter",
    "level_focus": "Scrap, ammo, and crafting materials",
    "security_profile": { "can_fight": false, "can_be_hired": false, "can_hire_security": false },
    "lore_connections": ["B.N.T.G. trade culture", "Supply outposts", "Level 1 service corridors"],
    "personality_hook": "Can judge metal quality by the sound it makes hitting a desk.",
    "description": "Parts trader for ammo crafting and repair economies."
  },
  {
    "npc_roster_id": "npc_roster_iva_lockgrail",
    "display_name": "Iva Lockgrail",
    "faction_id": "bntg",
    "primary_function": "QuestGiver",
    "services": ["Quest", "SecurityHire", "Storage"],
    "hub_location": "bntg_crate_office",
    "level_focus": "Supply crates and locker recovery",
    "security_profile": { "can_fight": true, "can_be_hired": false, "can_hire_security": true },
    "lore_connections": ["B.N.T.G. trade culture", "Supply outposts", "Movie Ticket economy"],
    "personality_hook": "Smiles when locks break cleanly.",
    "description": "B.N.T.G. crate boss who introduces paid security escorts later."
  },
  {
    "npc_roster_id": "npc_roster_bram_fusewick",
    "display_name": "Bram Fusewick",
    "faction_id": "bntg",
    "primary_function": "Hybrid",
    "services": ["Buy", "Sell", "Crafting", "Repair"],
    "hub_location": "bntg_ammo_stall",
    "level_focus": "Crude ammunition and weapons",
    "security_profile": { "can_fight": true, "can_be_hired": false, "can_hire_security": false },
    "lore_connections": ["B.N.T.G. trade culture", "Supply outposts", "Entity documentation"],
    "personality_hook": "Whispers around gunpowder like it is asleep.",
    "description": "Ammo crafter and rare weapon vendor."
  },
  {
    "npc_roster_id": "npc_roster_milo_pawnlight",
    "display_name": "Milo Pawnlight",
    "faction_id": "bntg",
    "primary_function": "SecurityBroker",
    "services": ["SecurityHire", "Buy", "Sell"],
    "hub_location": "bntg_guard_window",
    "level_focus": "Paid escort contracts",
    "security_profile": { "can_fight": false, "can_be_hired": false, "can_hire_security": true },
    "lore_connections": ["B.N.T.G. trade culture", "Movie Ticket economy", "Safe-room settlement life"],
    "personality_hook": "Calls every guard an investment and every corpse bad accounting.",
    "description": "Security broker for future hireable guards."
  },
  {
    "npc_roster_id": "npc_roster_tessa_rivet",
    "display_name": "Tessa Rivet",
    "faction_id": "bntg",
    "primary_function": "Security",
    "services": ["SecurityPatrol", "SecurityHire", "Training"],
    "hub_location": "bntg_market_gate",
    "level_focus": "Market defense",
    "security_profile": { "can_fight": true, "can_be_hired": true, "can_hire_security": false },
    "lore_connections": ["B.N.T.G. trade culture", "Supply outposts", "Safe-room settlement life"],
    "personality_hook": "Armored in mismatched plates, polite until the first warning ends.",
    "description": "Hireable B.N.T.G. guard archetype."
  },
  {
    "npc_roster_id": "npc_roster_rook_twine",
    "display_name": "Rook Twine",
    "faction_id": "clippers",
    "primary_function": "QuestGiver",
    "services": ["Quest", "Mapping", "Training"],
    "hub_location": "clippers_route_wall",
    "level_focus": "Trail String and shortcut discovery",
    "security_profile": { "can_fight": true, "can_be_hired": false, "can_hire_security": false },
    "lore_connections": ["Clippers route culture", "No-clip transitions", "Level 1 service corridors"],
    "personality_hook": "Ties knots while lying, unties them when telling the truth.",
    "description": "Route mentor for Trail String and hidden path quests."
  },
  {
    "npc_roster_id": "npc_roster_veya_skipjack",
    "display_name": "Veya Skipjack",
    "faction_id": "clippers",
    "primary_function": "Trader",
    "services": ["Buy", "Sell", "Mapping"],
    "hub_location": "clippers_thread_counter",
    "level_focus": "Navigation items",
    "security_profile": { "can_fight": false, "can_be_hired": false, "can_hire_security": false },
    "lore_connections": ["Clippers route culture", "No-clip transitions", "Movie Ticket economy"],
    "personality_hook": "Trades in maps that expire faster than milk.",
    "description": "Navigation trader for chalk, string, and route tools."
  },
  {
    "npc_roster_id": "npc_roster_hollis_camber",
    "display_name": "Hollis Camber",
    "faction_id": "clippers",
    "primary_function": "Hybrid",
    "services": ["Quest", "Radio", "Training"],
    "hub_location": "clippers_camcorder_wall",
    "level_focus": "Video proof and return routes",
    "security_profile": { "can_fight": true, "can_be_hired": true, "can_hire_security": false },
    "lore_connections": ["Clippers route culture", "Entity documentation", "No-clip transitions"],
    "personality_hook": "Only trusts footage if the timestamp is wrong.",
    "description": "Camcorder specialist and hireable scout."
  },
  {
    "npc_roster_id": "npc_roster_dax_understep",
    "display_name": "Dax Understep",
    "faction_id": "clippers",
    "primary_function": "Security",
    "services": ["SecurityPatrol", "SecurityHire"],
    "hub_location": "clippers_back_door",
    "level_focus": "Shortcut overwatch",
    "security_profile": { "can_fight": true, "can_be_hired": true, "can_hire_security": false },
    "lore_connections": ["Clippers route culture", "Level 1 service corridors", "Safe-room settlement life"],
    "personality_hook": "Appears behind people who swear they closed the door.",
    "description": "Hireable route guard for scout squads."
  },
  {
    "npc_roster_id": "npc_roster_noma_reel",
    "display_name": "Noma Reel",
    "faction_id": "clippers",
    "primary_function": "Trader",
    "services": ["Buy", "Sell", "Repair"],
    "hub_location": "clippers_tape_bench",
    "level_focus": "Camcorder and battery repair",